season	episode	scene	utterance	speaker	transcript	tokens	emotion
s01	e10	c01	u001	['Ross Geller']	Guys? There's a somebody I'd like you to meet.	"[['Guys', '?'], ['There', ""'s"", 'a', 'somebody', 'I', ""'d"", 'like', 'you', 'to', 'meet', '.']]"	Neutral
s01	e10	c01	u003	['#ALL#']	Oooh!	[['Oooh', '!']]	Joyful
s01	e10	c01	u004	['Monica Geller']	W-wait. What is that?	[['W', '-', 'wait', '.'], ['What', 'is', 'that', '?']]	Scared
s01	e10	c01	u005	['Ross Geller']	'That' would be Marcel. You wanna say hi?	"[[""'"", 'That', ""'"", 'would', 'be', 'Marcel', '.'], ['You', 'wan', 'na', 'say', 'hi', '?']]"	Joyful
s01	e10	c01	u006	['Monica Geller']	No, no, I don't.	"[['No', ',', 'no', ',', 'I', 'do', ""n't"", '.']]"	Scared
s01	e10	c01	u007	['Rachel Green']	Oh, he is precious! Where did you get him?	[['Oh', ',', 'he', 'is', 'precious', '!'], ['Where', 'did', 'you', 'get', 'him', '?']]	Joyful
s01	e10	c01	u008	['Ross Geller']	My friend Bethel rescued him from some lab.	[['My', 'friend', 'Bethel', 'rescued', 'him', 'from', 'some', 'lab', '.']]	Neutral
s01	e10	c01	u009	['Phoebe Buffay']	That is so cruel! Why? Why would a parent name their child Bethel?	[['That', 'is', 'so', 'cruel', '!'], ['Why', '?'], ['Why', 'would', 'a', 'parent', 'name', 'their', 'child', 'Bethel', '?']]	Neutral
s01	e10	c01	u010	['Chandler Bing']	Hey, that monkey's got a Ross on its ass!	"[['Hey', ',', 'that', 'monkey', ""'s"", 'got', 'a', 'Ross', 'on', 'its', 'ass', '!']]"	Joyful
s01	e10	c01	u011	['Monica Geller']	Ross, is he gonna live with you, like, in your apartment?	[['Ross', ',', 'is', 'he', 'gon', 'na', 'live', 'with', 'you', ',', 'like', ',', 'in', 'your', 'apartment', '?']]	Neutral
s01	e10	c01	u012	['Ross Geller']	Yeah. I mean, it's been kinda quiet since Carol left, so...	"[['Yeah', '.'], ['I', 'mean', ',', 'it', ""'s"", 'been', 'kinda', 'quiet', 'since', 'Carol', 'left', ',', 'so', '...']]"	Neutral
s01	e10	c01	u013	['Monica Geller']	Why don't you just get a roommate?	"[['Why', 'do', ""n't"", 'you', 'just', 'get', 'a', 'roommate', '?']]"	Neutral
s01	e10	c01	u014	['Ross Geller']	Nah, I dunno... I think you reach a certain age, having a roommate is kinda pathe- ....sorry, that's, that's 'pathet', which is Sanskrit for 'really cool way to live'.	"[['Nah', ',', 'I', 'du', 'n', 'no', '...'], ['I', 'think', 'you', 'reach', 'a', 'certain', 'age', ',', 'having', 'a', 'roommate', 'is', 'kinda', 'pathe', '-', '....'], ['sorry', ',', 'that', ""'s"", ',', 'that', ""'s"", ""'"", 'pathet', ""'"", ',', 'which', 'is', 'Sanskrit', 'for', ""'"", 'really', 'cool', 'way', 'to', 'live', ""'"", '.']]"	Sad
s01	e10	c04	u001	['David']	...But, you can't actually test this theory, because today's particle accelerators are nowhere near powerful enough to simulate these conditions.	"[['...'], ['But', ',', 'you', 'ca', ""n't"", 'actually', 'test', 'this', 'theory', ',', 'because', 'today', ""'s"", 'particle', 'accelerators', 'are', 'nowhere', 'near', 'powerful', 'enough', 'to', 'simulate', 'these', 'conditions', '.']]"	Powerful
s01	e10	c04	u002	['Phoebe Buffay']	Okay, alright, I have a question, then.	[['Okay', ',', 'alright', ',', 'I', 'have', 'a', 'question', ',', 'then', '.']]	Neutral
s01	e10	c04	u003	['David']	Yuh.	[['Yuh', '.']]	Neutral
s01	e10	c04	u004	['Phoebe Buffay']	Um, were you planning on kissing me ever?	[['Um', ',', 'were', 'you', 'planning', 'on', 'kissing', 'me', 'ever', '?']]	Neutral
s01	e10	c04	u005	['David']	Uh, that's definitely a, uh, valid question. And, uh, the answer would be yes. Yes I was. But, see, I wanted it to be this phenomenal kiss that happened at this phenomenal moment, because, well, 'cause it's you.	"[['Uh', ',', 'that', ""'s"", 'definitely', 'a', ',', 'uh', ',', 'valid', 'question', '.'], ['And', ',', 'uh', ',', 'the', 'answer', 'would', 'be', 'yes', '.'], ['Yes', 'I', 'was', '.'], ['But', ',', 'see', ',', 'I', 'wanted', 'it', 'to', 'be', 'this', 'phenomenal', 'kiss', 'that', 'happened', 'at', 'this', 'phenomenal', 'moment', ',', 'because', ',', 'well', ',', ""'cause"", 'it', ""'s"", 'you', '.']]"	Joyful
s01	e10	c04	u006	['Phoebe Buffay']	Sure.	[['Sure', '.']]	Neutral
s01	e10	c04	u007	['David']	Right. But, see, the longer I waited, the more phenomenal the kiss had to be, and now we've reached a place where it's just gotta be one of those things where I just like... sweep everything off the table and throw you down on it. And, uh, I'm not really a, uh, sweeping sorta fella.	"[['Right', '.'], ['But', ',', 'see', ',', 'the', 'longer', 'I', 'waited', ',', 'the', 'more', 'phenomenal', 'the', 'kiss', 'had', 'to', 'be', ',', 'and', 'now', 'we', ""'ve"", 'reached', 'a', 'place', 'where', 'it', ""'s"", 'just', 'got', 'ta', 'be', 'one', 'of', 'those', 'things', 'where', 'I', 'just', 'like', '...'], ['sweep', 'everything', 'off', 'the', 'table', 'and', 'throw', 'you', 'down', 'on', 'it', '.'], ['And', ',', 'uh', ',', 'I', ""'m"", 'not', 'really', 'a', ',', 'uh', ',', 'sweeping', 'sorta', 'fella', '.']]"	Scared
s01	e10	c04	u008	['Phoebe Buffay']	Oh, David, I, I think you are a sweeping sorta fella. I mean, you're a sweeper! ...trapped inside a physicist's body.	"[['Oh', ',', 'David', ',', 'I', ',', 'I', 'think', 'you', 'are', 'a', 'sweeping', 'sorta', 'fella', '.'], ['I', 'mean', ',', 'you', ""'re"", 'a', 'sweeper', '!'], ['...'], ['trapped', 'inside', 'a', 'physicist', ""'s"", 'body', '.']]"	Joyful
s01	e10	c04	u009	['David']	Rrrreally.	[['Rrrreally', '.']]	Neutral
s01	e10	c04	u010	['Phoebe Buffay']	Oh, yeah, oh, I'm sure of it. You should just do it, just sweep and throw me.	"[['Oh', ',', 'yeah', ',', 'oh', ',', 'I', ""'m"", 'sure', 'of', 'it', '.'], ['You', 'should', 'just', 'do', 'it', ',', 'just', 'sweep', 'and', 'throw', 'me', '.']]"	Joyful
s01	e10	c04	u011	['David']	...Now? Now?	[['...'], ['Now', '?'], ['Now', '?']]	Scared
s01	e10	c04	u012	['Phoebe Buffay']	Oh yeah, right now.	[['Oh', 'yeah', ',', 'right', 'now', '.']]	Powerful
s01	e10	c04	u013	['David']	Okay, okay, okay. Y'know what, this was just really expensive. And I'll take- this was a gift.	"[['Okay', ',', 'okay', ',', 'okay', '.'], [""Y'know"", 'what', ',', 'this', 'was', 'just', 'really', 'expensive', '.'], ['And', 'I', ""'ll"", 'take', '-', 'this', 'was', 'a', 'gift', '.']]"	Neutral
s01	e10	c04	u014	['Phoebe Buffay']	Okay, now you're just kinda tidying.	"[['Okay', ',', 'now', 'you', ""'re"", 'just', 'kinda', 'tidying', '.']]"	Neutral
s01	e10	c04	u015	['David']	Okay, what the hell, what the hell. You want me to actually throw you or you-you wanna just hop?	[['Okay', ',', 'what', 'the', 'hell', ',', 'what', 'the', 'hell', '.'], ['You', 'want', 'me', 'to', 'actually', 'throw', 'you', 'or', 'you', '-', 'you', 'wan', 'na', 'just', 'hop', '?']]	Joyful
s01	e10	c04	u016	['Phoebe Buffay']	I can hop.	[['I', 'can', 'hop', '.']]	Joyful
s01	e10	c06	u001	['Phoebe Buffay']	Hello?	[['Hello', '?']]	Scared
s01	e10	c06	u002	['David']	Hey!	[['Hey', '!']]	Joyful
s01	e10	c06	u003	['Phoebe Buffay']	Hi.	[['Hi', '.']]	Neutral
s01	e10	c06	u004	['David']	Hi! What-what're you doing here?	"[['Hi', '!'], ['What', '-', 'what', ""'re"", 'you', 'doing', 'here', '?']]"	Joyful
s01	e10	c06	u005	['Phoebe Buffay']	Um, well, Max told me about Minsk, so congratulations! This is so exciting!	[['Um', ',', 'well', ',', 'Max', 'told', 'me', 'about', 'Minsk', ',', 'so', 'congratulations', '!'], ['This', 'is', 'so', 'exciting', '!']]	Joyful
s01	e10	c06	u006	['Max']	It'd be even more exciting if we were going.	"[['It', ""'d"", 'be', 'even', 'more', 'exciting', 'if', 'we', 'were', 'going', '.']]"	Sad
s01	e10	c06	u007	['Phoebe Buffay']	Oh, you're not going? Oh, why?	"[['Oh', ',', 'you', ""'re"", 'not', 'going', '?'], ['Oh', ',', 'why', '?']]"	Joyful
s01	e10	c06	u008	['Max']	Tell her, David. 'I don't wanna go to Minsk and work with Lifson and Yamaguchi and Flench, on nonononononono. I wanna stay here and make out with my girlfriend!!'	"[['Tell', 'her', ',', 'David', '.'], [""'"", 'I', 'do', ""n't"", 'wan', 'na', 'go', 'to', 'Minsk', 'and', 'work', 'with', 'Lifson', 'and', 'Yamaguchi', 'and', 'Flench', ',', 'on', 'nonononononono', '.'], ['I', 'wan', 'na', 'stay', 'here', 'and', 'make', 'out', 'with', 'my', 'girlfriend', '!!'], [""'""]]"	Mad
s01	e10	c06	u009	['David']	Thank you, Max. Thank you.	[['Thank', 'you', ',', 'Max', '.'], ['Thank', 'you', '.']]	Peaceful
s01	e10	c06	u010	['Phoebe Buffay']	So-so you're really not going?	"[['So', '-', 'so', 'you', ""'re"", 'really', 'not', 'going', '?']]"	Neutral
s01	e10	c06	u011	['David']	I don't know. I don't know what I'm gonna do. I just- you decide.	"[['I', 'do', ""n't"", 'know', '.'], ['I', 'do', ""n't"", 'know', 'what', 'I', ""'m"", 'gon', 'na', 'do', '.'], ['I', 'just', '-', 'you', 'decide', '.']]"	Neutral
s01	e10	c06	u012	['Phoebe Buffay']	Oh don't do that.	"[['Oh', 'do', ""n't"", 'do', 'that', '.']]"	Scared
s01	e10	c06	u013	['David']	Please.	[['Please', '.']]	Neutral
s01	e10	c06	u014	['Phoebe Buffay']	Oh no no.	[['Oh', 'no', 'no', '.']]	Neutral
s01	e10	c06	u015	['David']	No, but I'm asking-	"[['No', ',', 'but', 'I', ""'m"", 'asking', '-']]"	Neutral
s01	e10	c06	u016	['Phoebe Buffay']	Oh, but I can't do that-	"[['Oh', ',', 'but', 'I', 'ca', ""n't"", 'do', 'that', '-']]"	Neutral
s01	e10	c06	u017	['David']	No, but I can't-	"[['No', ',', 'but', 'I', 'ca', ""n't"", '-']]"	Scared
s01	e10	c06	u018	['Phoebe Buffay']	It's your thing, and-	"[['It', ""'s"", 'your', 'thing', ',', 'and', '-']]"	Neutral
s01	e10	c06	u019	['David']	-make the decision-	[['-', 'make', 'the', 'decision', '-']]	Neutral
s01	e10	c06	u020	['Phoebe Buffay']	Okay, um, stay.	[['Okay', ',', 'um', ',', 'stay', '.']]	Neutral
s01	e10	c06	u021	['David']	Stay.	[['Stay', '.']]	Neutral
s01	e10	c06	u022	['Phoebe Buffay']	Stay.	[['Stay', '.']]	Neutral
s01	e10	c06	u024	['Phoebe Buffay']	Getting so good at that!	[['Getting', 'so', 'good', 'at', 'that', '!']]	Joyful
s01	e10	c06	u025	['David']	It was Max's stuff.	"[['It', 'was', 'Max', ""'s"", 'stuff', '.']]"	Peaceful
