season	episode	scene	utterance	speaker	transcript	tokens	emotion
s02	e06	c02	u002	['Phoebe Buffay']	Hey Rach, wanna hear the new song I'm thinkin' of singing this afternoon? I wrote it this morning in the shower.	"[['Hey', 'Rach', ',', 'wan', 'na', 'hear', 'the', 'new', 'song', 'I', ""'m"", 'thinkin', ""'"", 'of', 'singing', 'this', 'afternoon', '?'], ['I', 'wrote', 'it', 'this', 'morning', 'in', 'the', 'shower', '.']]"	Joyful
s02	e06	c02	u003	['Rachel Green']	Ok.	[['Ok', '.']]	Peaceful
s02	e06	c02	u004	['Phoebe Buffay']	I'm in the shower and I'm writing a song. Stop me if you've heard it. My skin is soapy, and my hair is wet, and Tegrin spelled backward is Nirget.	"[['I', ""'m"", 'in', 'the', 'shower', 'and', 'I', ""'m"", 'writing', 'a', 'song', '.'], ['Stop', 'me', 'if', 'you', ""'ve"", 'heard', 'it', '.'], ['My', 'skin', 'is', 'soapy', ',', 'and', 'my', 'hair', 'is', 'wet', ',', 'and', 'Tegrin', 'spelled', 'backward', 'is', 'Nirget', '.']]"	Peaceful
s02	e06	c02	u005	['Terry']	Uh, Rachel, sweetheart, could I see ya for a minute?	[['Uh', ',', 'Rachel', ',', 'sweetheart', ',', 'could', 'I', 'see', 'ya', 'for', 'a', 'minute', '?']]	Neutral
s02	e06	c02	u006	['Rachel Green']	What's up?	"[['What', ""'s"", 'up', '?']]"	Powerful
s02	e06	c02	u007	['Terry']	F.Y.I.. I've decided to pay a professional musician to play in here on Sunday afternoons. Her name is Stephanie... something. She's supposed to be very good.	"[['F.Y.I', '..'], ['I', ""'ve"", 'decided', 'to', 'pay', 'a', 'professional', 'musician', 'to', 'play', 'in', 'here', 'on', 'Sunday', 'afternoons', '.'], ['Her', 'name', 'is', 'Stephanie', '...'], ['something', '.'], ['She', ""'s"", 'supposed', 'to', 'be', 'very', 'good', '.']]"	Neutral
s02	e06	c02	u008	['Rachel Green']	But what about Phoebe?	[['But', 'what', 'about', 'Phoebe', '?']]	Mad
s02	e06	c02	u009	['Terry']	Rachel, it's not that your friend is bad, it's that she's so bad, she makes me want to put my finger through my eye into my brain and swirl it around.	"[['Rachel', ',', 'it', ""'s"", 'not', 'that', 'your', 'friend', 'is', 'bad', ',', 'it', ""'s"", 'that', 'she', ""'s"", 'so', 'bad', ',', 'she', 'makes', 'me', 'want', 'to', 'put', 'my', 'finger', 'through', 'my', 'eye', 'into', 'my', 'brain', 'and', 'swirl', 'it', 'around', '.']]"	Neutral
s02	e06	c02	u010	['Rachel Green']	Ok, ok, so you're not a fan, but I mean, come on, you cannot do this to her.	"[['Ok', ',', 'ok', ',', 'so', 'you', ""'re"", 'not', 'a', 'fan', ',', 'but', 'I', 'mean', ',', 'come', 'on', ',', 'you', 'can', 'not', 'do', 'this', 'to', 'her', '.']]"	Mad
s02	e06	c02	u011	['Terry']	Uh--	[['Uh', '--']]	Scared
s02	e06	c02	u012	['Rachel Green']	Oh, no no no no. Oh no no no no. I have to do this to her?	[['Oh', ',', 'no', 'no', 'no', 'no', '.'], ['Oh', 'no', 'no', 'no', 'no', '.'], ['I', 'have', 'to', 'do', 'this', 'to', 'her', '?']]	Mad
s02	e06	c02	u013	['Phoebe Buffay']	Lather, rinse, repeat, and lather, rinse, repeat, and lather, rinse, repeat, as needed.	[['Lather', ',', 'rinse', ',', 'repeat', ',', 'and', 'lather', ',', 'rinse', ',', 'repeat', ',', 'and', 'lather', ',', 'rinse', ',', 'repeat', ',', 'as', 'needed', '.']]	Joyful
s02	e06	c03	u002	['Chandler Bing']	You know, I don't think we brought enough stuff. Did you forget to pack the baby's anvil?	"[['You', 'know', ',', 'I', 'do', ""n't"", 'think', 'we', 'brought', 'enough', 'stuff', '.'], ['Did', 'you', 'forget', 'to', 'pack', 'the', 'baby', ""'s"", 'anvil', '?']]"	Scared
s02	e06	c03	u003	['Joey Tribbiani']	It's gonna be worth it. It's a known fact that women love babies, all righ? Women love guys who love babies. It's that whole sensitive thing. Quick, aim him at that pack o' babes over there. Maybe one of them will break away. No, no wait, for get them, we got one, hard left. All right, gimme the baby.	"[['It', ""'s"", 'gon', 'na', 'be', 'worth', 'it', '.'], ['It', ""'s"", 'a', 'known', 'fact', 'that', 'women', 'love', 'babies', ',', 'all', 'righ', '?'], ['Women', 'love', 'guys', 'who', 'love', 'babies', '.'], ['It', ""'s"", 'that', 'whole', 'sensitive', 'thing', '.'], ['Quick', ',', 'aim', 'him', 'at', 'that', 'pack', 'o', ""'"", 'babes', 'over', 'there', '.'], ['Maybe', 'one', 'of', 'them', 'will', 'break', 'away', '.'], ['No', ',', 'no', 'wait', ',', 'for', 'get', 'them', ',', 'we', 'got', 'one', ',', 'hard', 'left', '.'], ['All', 'right', ',', 'gim', 'me', 'the', 'baby', '.']]"	Joyful
s02	e06	c03	u004	['Chandler Bing']	No, I got him.	[['No', ',', 'I', 'got', 'him', '.']]	Neutral
s02	e06	c03	u005	['Joey Tribbiani']	No, seriously.	[['No', ',', 'seriously', '.']]	Scared
s02	e06	c03	u006	['Chandler Bing']	Oh, seriously you want him?	[['Oh', ',', 'seriously', 'you', 'want', 'him', '?']]	Scared
s02	e06	c03	u007	['Caroline']	Hello.	[['Hello', '.']]	Neutral
s02	e06	c03	u008	['Chandler Bing', 'Joey Tribbiani']	Hello.	[['Hello', '.']]	Neutral
s02	e06	c03	u009	['Caroline']	And who is this little cutie pie?	[['And', 'who', 'is', 'this', 'little', 'cutie', 'pie', '?']]	Joyful
s02	e06	c03	u010	['Chandler Bing']	Well, don't, don't think me immodest, but, me?	"[['Well', ',', 'do', ""n't"", ',', 'do', ""n't"", 'think', 'me', 'immodest', ',', 'but', ',', 'me', '?']]"	Scared
s02	e06	c03	u011	['Joey Tribbiani']	You wanna smell him?	[['You', 'wan', 'na', 'smell', 'him', '?']]	Joyful
s02	e06	c03	u012	['Caroline']	I assume we're talking about the baby now.	"[['I', 'assume', 'we', ""'re"", 'talking', 'about', 'the', 'baby', 'now', '.']]"	Peaceful
s02	e06	c03	u013	['Joey Tribbiani']	Oh, yeah. He's got that great baby smell. Get a whiff of his head.	"[['Oh', ',', 'yeah', '.'], ['He', ""'s"", 'got', 'that', 'great', 'baby', 'smell', '.'], ['Get', 'a', 'whiff', 'of', 'his', 'head', '.']]"	Joyful
s02	e06	c03	u014	['Caroline']	I think my uterus just skipped a beat.	[['I', 'think', 'my', 'uterus', 'just', 'skipped', 'a', 'beat', '.']]	Joyful
s02	e06	c03	u015	['Joey Tribbiani']	What'd I tell you? What'd I tell you?	"[['What', ""'d"", 'I', 'tell', 'you', '?'], ['What', ""'d"", 'I', 'tell', 'you', '?']]"	Joyful
s02	e06	c03	u016	['Caroline']	I think it's great you guys are doing this.	"[['I', 'think', 'it', ""'s"", 'great', 'you', 'guys', 'are', 'doing', 'this', '.']]"	Joyful
s02	e06	c03	u017	['Chandler Bing']	Well, we are great guys.	[['Well', ',', 'we', 'are', 'great', 'guys', '.']]	Powerful
s02	e06	c03	u018	['Caroline']	You know, my brother and his boyfriend have been trying to adopt for three years. What agency did you two go through?	[['You', 'know', ',', 'my', 'brother', 'and', 'his', 'boyfriend', 'have', 'been', 'trying', 'to', 'adopt', 'for', 'three', 'years', '.'], ['What', 'agency', 'did', 'you', 'two', 'go', 'through', '?']]	Peaceful
s02	e06	c05	u002	['Rachel Green']	Hey.	[['Hey', '.']]	Neutral
s02	e06	c05	u003	['Phoebe Buffay']	Oh, hi.	[['Oh', ',', 'hi', '.']]	Neutral
s02	e06	c05	u004	['Rachel Green']	Here. I thought you might be cold.	[['Here', '.'], ['I', 'thought', 'you', 'might', 'be', 'cold', '.']]	Peaceful
s02	e06	c05	u005	['Phoebe Buffay']	Thank you.	[['Thank', 'you', '.']]	Joyful
s02	e06	c05	u006	['Rachel Green']	Whoa, look at you, you did pretty well.	[['Whoa', ',', 'look', 'at', 'you', ',', 'you', 'did', 'pretty', 'well', '.']]	Powerful
s02	e06	c05	u007	['Phoebe Buffay']	Eight dollars and 27 cents. But not really, 'cause I put in the first two, just to, you know, get the ball rolling, and to make myself feel better.	"[['Eight', 'dollars', 'and', '27', 'cents', '.'], ['But', 'not', 'really', ',', ""'cause"", 'I', 'put', 'in', 'the', 'first', 'two', ',', 'just', 'to', ',', 'you', 'know', ',', 'get', 'the', 'ball', 'rolling', ',', 'and', 'to', 'make', 'myself', 'feel', 'better', '.']]"	Sad
s02	e06	c05	u008	['Rachel Green']	Do you?	[['Do', 'you', '?']]	Neutral
s02	e06	c05	u009	['Phoebe Buffay']	"No. This whole like playing-for-money thing is so not good for me. You know, I don't know, when I sang ""Su-Su-Suicide"", I got a dollar seventy-five. But then, ""Smelly Cat"", I got 25 cents and a condom. So you know, now I just feel really bad for Smelly Cat."	"[['No', '.'], ['This', 'whole', 'like', 'playing', '-', 'for', '-', 'money', 'thing', 'is', 'so', 'not', 'good', 'for', 'me', '.'], ['You', 'know', ',', 'I', 'do', ""n't"", 'know', ',', 'when', 'I', 'sang', '""', 'Su', '-', 'Su', '-', 'Suicide', '""', ',', 'I', 'got', 'a', 'dollar', 'seventy', '-', 'five', '.'], ['But', 'then', ',', '""', 'Smelly', 'Cat', '""', ',', 'I', 'got', '25', 'cents', 'and', 'a', 'condom', '.'], ['So', 'you', 'know', ',', 'now', 'I', 'just', 'feel', 'really', 'bad', 'for', 'Smelly', 'Cat', '.']]"	Sad
s02	e06	c05	u010	['Rachel Green']	Well, you know, honey, I don't think everybody gets Smelly Cat. You know, I mean, if all you've ever actually had are healthy pets, then, whoosh!	"[['Well', ',', 'you', 'know', ',', 'honey', ',', 'I', 'do', ""n't"", 'think', 'everybody', 'gets', 'Smelly', 'Cat', '.'], ['You', 'know', ',', 'I', 'mean', ',', 'if', 'all', 'you', ""'ve"", 'ever', 'actually', 'had', 'are', 'healthy', 'pets', ',', 'then', ',', 'whoosh', '!']]"	Neutral
s02	e06	c05	u011	['Phoebe Buffay']	It's not even that. I used to do my songs because it made me happy, but now it's like, it's just all about the money.	"[['It', ""'s"", 'not', 'even', 'that', '.'], ['I', 'used', 'to', 'do', 'my', 'songs', 'because', 'it', 'made', 'me', 'happy', ',', 'but', 'now', 'it', ""'s"", 'like', ',', 'it', ""'s"", 'just', 'all', 'about', 'the', 'money', '.']]"	Sad
s02	e06	c05	u012	['Rachel Green']	"Well, people missed you in there. And in fact, there was actually a request for ""Smelly Cat""."	"[['Well', ',', 'people', 'missed', 'you', 'in', 'there', '.'], ['And', 'in', 'fact', ',', 'there', 'was', 'actually', 'a', 'request', 'for', '""', 'Smelly', 'Cat', '""', '.']]"	Neutral
s02	e06	c05	u013	['Phoebe Buffay']	Really? From who?	[['Really', '?'], ['From', 'who', '?']]	Scared
s02	e06	c05	u014	['Rachel Green']	Well, from me. And I know it's not your big money song, but it's my favorite.	"[['Well', ',', 'from', 'me', '.'], ['And', 'I', 'know', 'it', ""'s"", 'not', 'your', 'big', 'money', 'song', ',', 'but', 'it', ""'s"", 'my', 'favorite', '.']]"	Peaceful
s02	e06	c05	u015	['Kid']	Hi. Uh, did I accidentally drop a condom in your case? It's kind of an emergency.	"[['Hi', '.'], ['Uh', ',', 'did', 'I', 'accidentally', 'drop', 'a', 'condom', 'in', 'your', 'case', '?'], ['It', ""'s"", 'kind', 'of', 'an', 'emergency', '.']]"	Scared
s02	e06	c05	u016	['Phoebe Buffay']	Yeah. Here you go.	[['Yeah', '.'], ['Here', 'you', 'go', '.']]	Neutral
s02	e06	c05	u017	['Kid']	Thanks a lot. Hey Christine, I got it!	[['Thanks', 'a', 'lot', '.'], ['Hey', 'Christine', ',', 'I', 'got', 'it', '!']]	Joyful
