season	episode	scene	utterance	speaker	transcript	tokens	emotion
s03	e03	c02	u002	['Monica Geller']	Hey, look at me. I'm making jam, been at it since 4 o'clock this morning.	"[['Hey', ',', 'look', 'at', 'me', '.'], ['I', ""'m"", 'making', 'jam', ',', 'been', 'at', 'it', 'since', '4', ""o'clock"", 'this', 'morning', '.']]"	Joyful
s03	e03	c02	u003	['Ross Geller']	Where'd you get fruit at four in the morning?	"[['Where', ""'d"", 'you', 'get', 'fruit', 'at', 'four', 'in', 'the', 'morning', '?']]"	Neutral
s03	e03	c02	u004	['Monica Geller']	Went down to the docks. Bet ya didn't know you could get it wholesale.	"[['Went', 'down', 'to', 'the', 'docks', '.'], ['Bet', 'ya', 'did', ""n't"", 'know', 'you', 'could', 'get', 'it', 'wholesale', '.']]"	Joyful
s03	e03	c02	u005	['Rachel Green']	I didn't know there were docks.	"[['I', 'did', ""n't"", 'know', 'there', 'were', 'docks', '.']]"	Neutral
s03	e03	c02	u007	['Joey Tribbiani']	Hey.	[['Hey', '.']]	Peaceful
s03	e03	c02	u008	['Chandler Bing']	Hey.	[['Hey', '.']]	Neutral
s03	e03	c02	u009	['Ross Geller']	Aww, is it broken?	[['Aww', ',', 'is', 'it', 'broken', '?']]	Scared
s03	e03	c02	u010	['Joey Tribbiani']	No, I gotta wear this thing for a couple weeks.	[['No', ',', 'I', 'got', 'ta', 'wear', 'this', 'thing', 'for', 'a', 'couple', 'weeks', '.']]	Sad
s03	e03	c02	u011	['Rachel Green']	Did you tell the doctor you did it jumping up and down on your bed?	[['Did', 'you', 'tell', 'the', 'doctor', 'you', 'did', 'it', 'jumping', 'up', 'and', 'down', 'on', 'your', 'bed', '?']]	Joyful
s03	e03	c02	u012	['Joey Tribbiani']	Nooo. I had a story all worked out but then Chandler sold me out.	[['Nooo', '.'], ['I', 'had', 'a', 'story', 'all', 'worked', 'out', 'but', 'then', 'Chandler', 'sold', 'me', 'out', '.']]	Mad
s03	e03	c02	u013	['Chandler Bing']	Well, I'm sorry Joe. I didn't think the doctor was gonna buy that it just *fell* out of the socket.	"[['Well', ',', 'I', ""'m"", 'sorry', 'Joe', '.'], ['I', 'did', ""n't"", 'think', 'the', 'doctor', 'was', 'gon', 'na', 'buy', 'that', 'it', 'just', '*', 'fell', '*', 'out', 'of', 'the', 'socket', '.']]"	Mad
s03	e03	c02	u014	['Joey Tribbiani']	What is this? Fruit?	[['What', 'is', 'this', '?'], ['Fruit', '?']]	Neutral
s03	e03	c02	u015	['Rachel Green']	Monica's making jam.	"[['Monica', ""'s"", 'making', 'jam', '.']]"	Joyful
s03	e03	c02	u016	['Joey Tribbiani']	Whoa, jam! I love jam! Hey, how come we never have jam at our place?	[['Whoa', ',', 'jam', '!'], ['I', 'love', 'jam', '!'], ['Hey', ',', 'how', 'come', 'we', 'never', 'have', 'jam', 'at', 'our', 'place', '?']]	Joyful
s03	e03	c02	u017	['Chandler Bing']	Because the kids need new shoes.	[['Because', 'the', 'kids', 'need', 'new', 'shoes', '.']]	Mad
s03	e03	c02	u018	['Monica Geller']	I'm going into business people. I'm sick and tired of being depressed about Richard. I needed a plan, a plan to get over my man. What's the opposite of man? Jam. Oh Joey don't! It's way to hot.	"[['I', ""'m"", 'going', 'into', 'business', 'people', '.'], ['I', ""'m"", 'sick', 'and', 'tired', 'of', 'being', 'depressed', 'about', 'Richard', '.'], ['I', 'needed', 'a', 'plan', ',', 'a', 'plan', 'to', 'get', 'over', 'my', 'man', '.'], ['What', ""'s"", 'the', 'opposite', 'of', 'man', '?'], ['Jam', '.'], ['Oh', 'Joey', 'do', ""n't"", '!'], ['It', ""'s"", 'way', 'to', 'hot', '.']]"	Joyful
s03	e03	c02	u019	['Joey Tribbiani']	This will just be my batch.	[['This', 'will', 'just', 'be', 'my', 'batch', '.']]	Peaceful
s03	e03	c03	u002	['Phoebe Buffay']	Um, that's it. No. Hey! You! J. Crew guy. Yeah. Why have you been following me? I mean, all week long everywhere I look there's you.	"[['Um', ',', 'that', ""'s"", 'it', '.'], ['No', '.'], ['Hey', '!'], ['You', '!'], ['J.', 'Crew', 'guy', '.'], ['Yeah', '.'], ['Why', 'have', 'you', 'been', 'following', 'me', '?'], ['I', 'mean', ',', 'all', 'week', 'long', 'everywhere', 'I', 'look', 'there', ""'s"", 'you', '.']]"	Scared
s03	e03	c03	u003	['Guy']	You wouldn't return my calls, you sent back my letters....	"[['You', 'would', ""n't"", 'return', 'my', 'calls', ',', 'you', 'sent', 'back', 'my', 'letters', '....']]"	Sad
s03	e03	c03	u004	['Phoebe Buffay']	What?	[['What', '?']]	Neutral
s03	e03	c03	u005	['Guy']	One more chance Ursula, please?	[['One', 'more', 'chance', 'Ursula', ',', 'please', '?']]	Sad
s03	e03	c03	u006	['Phoebe Buffay']	Oooh. Oh, well this is awkward.	[['Oooh', '.'], ['Oh', ',', 'well', 'this', 'is', 'awkward', '.']]	Neutral
s03	e03	c03	u007	['Guy']	Wh..	[['Wh', '..']]	Scared
s03	e03	c03	u008	['Phoebe Buffay']	Um, yeah, you want Ursula, and I'm Phoebe. Twin sisters! Seriously.	"[['Um', ',', 'yeah', ',', 'you', 'want', 'Ursula', ',', 'and', 'I', ""'m"", 'Phoebe', '.'], ['Twin', 'sisters', '!'], ['Seriously', '.']]"	Neutral
s03	e03	c03	u009	['Guy']	Oh, that's great. I'm stalking the wrong woman. I am such a dingus!	"[['Oh', ',', 'that', ""'s"", 'great', '.'], ['I', ""'m"", 'stalking', 'the', 'wrong', 'woman', '.'], ['I', 'am', 'such', 'a', 'dingus', '!']]"	Powerful
s03	e03	c03	u010	['Phoebe Buffay']	Oh, you're not a dingus.	"[['Oh', ',', 'you', ""'re"", 'not', 'a', 'dingus', '.']]"	Neutral
s03	e03	c03	u011	['Guy']	I just, I want you to know I didn't used to be like this. Before I meet your sister I was like this normal guy who sold beepers and cellular phones.	"[['I', 'just', ',', 'I', 'want', 'you', 'to', 'know', 'I', 'did', ""n't"", 'used', 'to', 'be', 'like', 'this', '.'], ['Before', 'I', 'meet', 'your', 'sister', 'I', 'was', 'like', 'this', 'normal', 'guy', 'who', 'sold', 'beepers', 'and', 'cellular', 'phones', '.']]"	Sad
s03	e03	c03	u012	['Phoebe Buffay']	Well, I mean look it's, it's not your fault, you know. I mean this is just what, what she does to guys, okay.	"[['Well', ',', 'I', 'mean', 'look', 'it', ""'s"", ',', 'it', ""'s"", 'not', 'your', 'fault', ',', 'you', 'know', '.'], ['I', 'mean', 'this', 'is', 'just', 'what', ',', 'what', 'she', 'does', 'to', 'guys', ',', 'okay', '.']]"	Neutral
s03	e03	c03	u013	['Guy']	Well thanks.	[['Well', 'thanks', '.']]	Neutral
s03	e03	c03	u014	['Phoebe Buffay']	Wait, you know what, I got a little story. When I was in Junior High School I went through this period where I thought I was a witch. And there was this guidance counselor who said something to me, that I think will help you a lot. He said okay, 'you're not a witch you're just an average student.' See what I'm saying?	"[['Wait', ',', 'you', 'know', 'what', ',', 'I', 'got', 'a', 'little', 'story', '.'], ['When', 'I', 'was', 'in', 'Junior', 'High', 'School', 'I', 'went', 'through', 'this', 'period', 'where', 'I', 'thought', 'I', 'was', 'a', 'witch', '.'], ['And', 'there', 'was', 'this', 'guidance', 'counselor', 'who', 'said', 'something', 'to', 'me', ',', 'that', 'I', 'think', 'will', 'help', 'you', 'a', 'lot', '.'], ['He', 'said', 'okay', ',', ""'"", 'you', ""'re"", 'not', 'a', 'witch', 'you', ""'re"", 'just', 'an', 'average', 'student', '.'], [""'"", 'See', 'what', 'I', ""'m"", 'saying', '?']]"	Peaceful
s03	e03	c03	u015	['Guy']	Not really.	[['Not', 'really', '.']]	Scared
s03	e03	c03	u016	['Phoebe Buffay']	Um, well, get over it. So, I mean you, you just seem to be a really nice guy, you know. Don't be so hard on yourself okay.	"[['Um', ',', 'well', ',', 'get', 'over', 'it', '.'], ['So', ',', 'I', 'mean', 'you', ',', 'you', 'just', 'seem', 'to', 'be', 'a', 'really', 'nice', 'guy', ',', 'you', 'know', '.'], ['Do', ""n't"", 'be', 'so', 'hard', 'on', 'yourself', 'okay', '.']]"	Neutral
s03	e03	c03	u017	['Guy']	Wait. You're right. I know you're right. And, thanks for being so nice. Here	"[['Wait', '.'], ['You', ""'re"", 'right', '.'], ['I', 'know', 'you', ""'re"", 'right', '.'], ['And', ',', 'thanks', 'for', 'being', 'so', 'nice', '.'], ['Here']]"	Peaceful
s03	e03	c03	u018	['Phoebe Buffay']	Oh, thanks a lot. Do you want to get a cup of coffee?	[['Oh', ',', 'thanks', 'a', 'lot', '.'], ['Do', 'you', 'want', 'to', 'get', 'a', 'cup', 'of', 'coffee', '?']]	Neutral
s03	e03	c03	u019	['Guy']	Yeah, okay.	[['Yeah', ',', 'okay', '.']]	Joyful
s03	e03	c03	u020	['Phoebe Buffay']	Okay. Okay, you don't have to walk behind me any more.	"[['Okay', '.'], ['Okay', ',', 'you', 'do', ""n't"", 'have', 'to', 'walk', 'behind', 'me', 'any', 'more', '.']]"	Neutral
s03	e03	c03	u021	['Guy']	Sorry.	[['Sorry', '.']]	Sad
s03	e03	c07	u002	['Malcom']	Here's my binoculars.	"[['Here', ""'s"", 'my', 'binoculars', '.']]"	Neutral
s03	e03	c07	u003	['Phoebe Buffay']	Oh, great. Great. You're doing great, you know real strong. Going strong. Keep going.	"[['Oh', ',', 'great', '.'], ['Great', '.'], ['You', ""'re"", 'doing', 'great', ',', 'you', 'know', 'real', 'strong', '.'], ['Going', 'strong', '.'], ['Keep', 'going', '.']]"	Powerful
s03	e03	c07	u004	['Malcom']	These are my night vision goggles. This is the book I pretend to read when I'm watching her in the park. And these are Mad Lips, they're just for fun.	"[['These', 'are', 'my', 'night', 'vision', 'goggles', '.'], ['This', 'is', 'the', 'book', 'I', 'pretend', 'to', 'read', 'when', 'I', ""'m"", 'watching', 'her', 'in', 'the', 'park', '.'], ['And', 'these', 'are', 'Mad', 'Lips', ',', 'they', ""'re"", 'just', 'for', 'fun', '.']]"	Joyful
s03	e03	c07	u005	['Phoebe Buffay']	Oh, yeah. What's this?	"[['Oh', ',', 'yeah', '.'], ['What', ""'s"", 'this', '?']]"	Neutral
s03	e03	c07	u006	['Malcom']	Oh, this is log I kept, recording her every movement. Do you wanna here something from it?	[['Oh', ',', 'this', 'is', 'log', 'I', 'kept', ',', 'recording', 'her', 'every', 'movement', '.'], ['Do', 'you', 'wan', 'na', 'here', 'something', 'from', 'it', '?']]	Sad
s03	e03	c07	u007	['Phoebe Buffay']	Um, not even a little bit.	[['Um', ',', 'not', 'even', 'a', 'little', 'bit', '.']]	Sad
s03	e03	c07	u008	['Malcom']	It's about you.	"[['It', ""'s"", 'about', 'you', '.']]"	Scared
s03	e03	c07	u009	['Phoebe Buffay']	Oh, okay then.	[['Oh', ',', 'okay', 'then', '.']]	Powerful
s03	e03	c07	u010	['Malcom']	I met Phoebe today. She was really nice to me eventhough I'm such a loser. And, then when I was walking home I thought about her a lot, it was weird, but kinda cool.	"[['I', 'met', 'Phoebe', 'today', '.'], ['She', 'was', 'really', 'nice', 'to', 'me', 'eventhough', 'I', ""'m"", 'such', 'a', 'loser', '.'], ['And', ',', 'then', 'when', 'I', 'was', 'walking', 'home', 'I', 'thought', 'about', 'her', 'a', 'lot', ',', 'it', 'was', 'weird', ',', 'but', 'kinda', 'cool', '.']]"	Joyful
s03	e03	c07	u011	['Phoebe Buffay']	Good. So what were you thinking?	[['Good', '.'], ['So', 'what', 'were', 'you', 'thinking', '?']]	Peaceful
s03	e03	c07	u012	['Malcom']	I was thinking what it would be like to kiss you.	[['I', 'was', 'thinking', 'what', 'it', 'would', 'be', 'like', 'to', 'kiss', 'you', '.']]	Joyful
s03	e03	c07	u013	['Phoebe Buffay']	Really?	[['Really', '?']]	Joyful
s03	e03	c07	u014	['Malcom']	No.	[['No', '.']]	Mad
s03	e03	c07	u015	['Phoebe Buffay']	Oh.	[['Oh', '.']]	Sad
s03	e03	c07	u016	['Malcom']	See that's just something I said now, so that maybe I could kiss you.	"[['See', 'that', ""'s"", 'just', 'something', 'I', 'said', 'now', ',', 'so', 'that', 'maybe', 'I', 'could', 'kiss', 'you', '.']]"	Powerful
s03	e03	c07	u017	['Phoebe Buffay']	Oh, okay.	[['Oh', ',', 'okay', '.']]	Joyful
s03	e03	c09	u002	['Rachel Green']	Oh my God, what happened?	[['Oh', 'my', 'God', ',', 'what', 'happened', '?']]	Scared
s03	e03	c09	u003	['Janice Litman Goralnik']	Oh. God, crazy Chandler. He spun me...off...the...bed!	[['Oh', '.'], ['God', ',', 'crazy', 'Chandler', '.'], ['He', 'spun', 'me', '...'], ['off', '...'], ['the', '...'], ['bed', '!']]	Scared
s03	e03	c09	u004	['Rachel Green']	Wow! Spinning that sounds like fun.	[['Wow', '!'], ['Spinning', 'that', 'sounds', 'like', 'fun', '.']]	Joyful
s03	e03	c09	u005	['Janice Litman Goralnik']	Oh, I wish. No, you know he was just trying Ross's Hug and Roll thing.	"[['Oh', ',', 'I', 'wish', '.'], ['No', ',', 'you', 'know', 'he', 'was', 'just', 'trying', 'Ross', ""'s"", 'Hug', 'and', 'Roll', 'thing', '.']]"	Joyful
s03	e03	c09	u006	['Rachel Green']	Ross's what?	"[['Ross', ""'s"", 'what', '?']]"	Neutral
s03	e03	c09	u007	['Janice Litman Goralnik']	You know what, where he hugs you and kinda rolls you away and... Oh... my....God.	[['You', 'know', 'what', ',', 'where', 'he', 'hugs', 'you', 'and', 'kinda', 'rolls', 'you', 'away', 'and', '...'], ['Oh', '...'], ['my', '....'], ['God', '.']]	Joyful
s03	e03	c10	u002	['Malcom']	Phoebe?	[['Phoebe', '?']]	Scared
s03	e03	c10	u003	['Phoebe Buffay']	Yes? Yes! Oh.	[['Yes', '?'], ['Yes', '!'], ['Oh', '.']]	Joyful
s03	e03	c10	u004	['Malcom']	What are you doing?	[['What', 'are', 'you', 'doing', '?']]	Neutral
s03	e03	c10	u005	['Phoebe Buffay']	Oh, I was just here looking for, um, my um, my part of an old sandwich. Oh, here it is! Oh.	[['Oh', ',', 'I', 'was', 'just', 'here', 'looking', 'for', ',', 'um', ',', 'my', 'um', ',', 'my', 'part', 'of', 'an', 'old', 'sandwich', '.'], ['Oh', ',', 'here', 'it', 'is', '!'], ['Oh', '.']]	Peaceful
s03	e03	c10	u006	['Malcom']	Were you following me?	[['Were', 'you', 'following', 'me', '?']]	Scared
s03	e03	c10	u007	['Phoebe Buffay']	Um, perhaps. Yes! Yes, I'm sorry, I'm sorry. I was just afraid that you were still hung up on my sister.	"[['Um', ',', 'perhaps', '.'], ['Yes', '!'], ['Yes', ',', 'I', ""'m"", 'sorry', ',', 'I', ""'m"", 'sorry', '.'], ['I', 'was', 'just', 'afraid', 'that', 'you', 'were', 'still', 'hung', 'up', 'on', 'my', 'sister', '.']]"	Joyful
s03	e03	c10	u008	['Malcom']	So you spied on me. I can't believe you don't trust me.	"[['So', 'you', 'spied', 'on', 'me', '.'], ['I', 'ca', ""n't"", 'believe', 'you', 'do', ""n't"", 'trust', 'me', '.']]"	Scared
s03	e03	c10	u009	['Phoebe Buffay']	Oh well, what do you know, there goes my identical twin sister. Just walkin' along looking like me. What, is this just like a freakish coincidence, or did you know she takes this train?	"[['Oh', 'well', ',', 'what', 'do', 'you', 'know', ',', 'there', 'goes', 'my', 'identical', 'twin', 'sister', '.'], ['Just', 'walkin', ""'"", 'along', 'looking', 'like', 'me', '.'], ['What', ',', 'is', 'this', 'just', 'like', 'a', 'freakish', 'coincidence', ',', 'or', 'did', 'you', 'know', 'she', 'takes', 'this', 'train', '?']]"	Neutral
s03	e03	c10	u010	['Malcom']	I'm sorry. I'm sorry. I tried to stop, but I couldn't. I'm so pathetic.	"[['I', ""'m"", 'sorry', '.'], ['I', ""'m"", 'sorry', '.'], ['I', 'tried', 'to', 'stop', ',', 'but', 'I', 'could', ""n't"", '.'], ['I', ""'m"", 'so', 'pathetic', '.']]"	Sad
s03	e03	c10	u011	['Phoebe Buffay']	No, no, it's not your fault. You know it's partly my fault, 'cause I made you quit cold turkey. Sorry, no. Okay, well, I mean, I can't date you anymore, 'cause your, you know Wow! But um, but I will definitely, definitely help you get over my sister. Okay, stalk me for a while. Huh? Yeah, and, and, and, I'll be like an Ursula patch.	"[['No', ',', 'no', ',', 'it', ""'s"", 'not', 'your', 'fault', '.'], ['You', 'know', 'it', ""'s"", 'partly', 'my', 'fault', ',', ""'cause"", 'I', 'made', 'you', 'quit', 'cold', 'turkey', '.'], ['Sorry', ',', 'no', '.'], ['Okay', ',', 'well', ',', 'I', 'mean', ',', 'I', 'ca', ""n't"", 'date', 'you', 'anymore', ',', ""'cause"", 'your', ',', 'you', 'know', 'Wow', '!'], ['But', 'um', ',', 'but', 'I', 'will', 'definitely', ',', 'definitely', 'help', 'you', 'get', 'over', 'my', 'sister', '.'], ['Okay', ',', 'stalk', 'me', 'for', 'a', 'while', '.'], ['Huh', '?'], ['Yeah', ',', 'and', ',', 'and', ',', 'and', ',', 'I', ""'ll"", 'be', 'like', 'an', 'Ursula', 'patch', '.']]"	Joyful
s03	e03	c10	u012	['Malcom']	Uh-huh, I don't know.	"[['Uh-huh', ',', 'I', 'do', ""n't"", 'know', '.']]"	Scared
s03	e03	c10	u013	['Phoebe Buffay']	Yeah, just, okay, look I'm going. Um, come on. Op, op, behind the pillar, which way am I gonna go?	"[['Yeah', ',', 'just', ',', 'okay', ',', 'look', 'I', ""'m"", 'going', '.'], ['Um', ',', 'come', 'on', '.'], ['Op', ',', 'op', ',', 'behind', 'the', 'pillar', ',', 'which', 'way', 'am', 'I', 'gon', 'na', 'go', '?']]"	Neutral
s03	e03	c12	u002	['Joey Tribbiani']	I called the sperm bank today, they haven't sold a single unit of Tribianni. Nobody wants my product. I mean, I-I-I don't get it Maybe if they met me in person.	"[['I', 'called', 'the', 'sperm', 'bank', 'today', ',', 'they', 'have', ""n't"", 'sold', 'a', 'single', 'unit', 'of', 'Tribianni', '.'], ['Nobody', 'wants', 'my', 'product', '.'], ['I', 'mean', ',', 'I-I-I', 'do', ""n't"", 'get', 'it', 'Maybe', 'if', 'they', 'met', 'me', 'in', 'person', '.']]"	Sad
s03	e03	c12	u003	['Rachel Green']	Honey, you got a little thing on your...	[['Honey', ',', 'you', 'got', 'a', 'little', 'thing', 'on', 'your', '...']]	Neutral
s03	e03	c12	u004	['Joey Tribbiani']	Did I get it?	[['Did', 'I', 'get', 'it', '?']]	Mad
s03	e03	c12	u005	['Rachel Green']	Yeah.	[['Yeah', '.']]	Neutral
s03	e03	c12	u006	['Ross Geller']	Hello.	[['Hello', '.']]	Joyful
s03	e03	c12	u007	['Rachel Green']	Hello.	[['Hello', '.']]	Neutral
s03	e03	c12	u008	['Ross Geller']	Hey. Uh, Chan, can I uh, can I talk to you for a second?	[['Hey', '.'], ['Uh', ',', 'Chan', ',', 'can', 'I', 'uh', ',', 'can', 'I', 'talk', 'to', 'you', 'for', 'a', 'second', '?']]	Scared
s03	e03	c12	u009	['Chandler Bing']	Sure. What's up?	"[['Sure', '.'], ['What', ""'s"", 'up', '?']]"	Neutral
s03	e03	c12	u010	['Ross Geller']	Just one uh, one additional relationship thought. Probably something your already familiar with, uh, women talk!	[['Just', 'one', 'uh', ',', 'one', 'additional', 'relationship', 'thought', '.'], ['Probably', 'something', 'your', 'already', 'familiar', 'with', ',', 'uh', ',', 'women', 'talk', '!']]	Mad
